{
  "paper_width": "80mm",
  "header": "APPLYWIZZ",
  "subheader": "OFFICE PANTRY",
  "meal_header": "APPLYWIZZ",
  "meal_subheader": "MEAL TOKEN",
  "footer": "DELIVER ASAP!",
  "custom_label": {
    "enabled": false,
    "text": "",
    "position": "after_header",
    "bold": true
  },
  "context": {
    "order_number": true,
    "date": true,
    "employee": true,
    "location": true,
    "item": true,
    "note": true,
    "tokens": true,
    "guest_marker": true
  },
  "feed_lines": 3,
  "cut_mode": "partial"
}